Name,Handle,Media URL,Retweets,Likes,Comments,Views,Tweet URL,Profile Link,Post Body,Date,Timestamp
ibrahima GAYE,@ibougayesaudi,,,2,1,773,https://twitter.com/ibougayesaudi/status/1605890084233826304,https://twitter.com/ibougayesaudi,"Hélas tu étais bien partis pour être Là Référence en Afrique sub-saharienne. Tu étais l’espoir d’une nouvelle génération de leaders, capables de relever plusieurs défis comme l’histoire et l’éducation qui sont gages de tout développement , de la refondation de l’Etat postcolonial","Dec 22, 2022",2022-12-22T11:36:46.000Z
𝑴𝒐𝒖𝒉𝒂 𝑳𝒂𝒉𝒊,@Boy_Pikine,"https://pbs.twimg.com/media/Fkh1c7mXEAAMfFq?format=jpg&name=small, https://pbs.twimg.com/media/Fkh1c7mXEAAMfFq?format=jpg&name=small",10.0,165,2,6K,https://twitter.com/Boy_Pikine/status/1605662411913977856,https://twitter.com/Boy_Pikine,Sois sage alors,"Dec 21, 2022",2022-12-21T20:32:05.000Z
Gaby SAGNA,@SagnaGaby,,,18,1,1.6K,https://twitter.com/SagnaGaby/status/1605662415487750145,https://twitter.com/SagnaGaby,Nioune dhei kou ligueyoul ak kouy wakh wakhi 3ieme mandat laniouye bagne à bon entendeur salut,"Dec 21, 2022",2022-12-21T20:32:06.000Z
ibn_Cheikhou,@ibn_cheikhou,,,1,,379,https://twitter.com/ibn_cheikhou/status/1605662454645751813,https://twitter.com/ibn_cheikhou,Yow mayñou diam,"Dec 21, 2022",2022-12-21T20:32:15.000Z
M.H.S,@agost8,https://pbs.twimg.com/media/Fkh2Wi-WQAEqp8a?format=jpg&name=small,,29,1,2.2K,https://twitter.com/agost8/status/1605663399182041089,https://twitter.com/agost8,Ok degeunagn leu wayé,"Dec 21, 2022",2022-12-21T20:36:00.000Z
Mots-doux Dass,@Mamadou41426631,,,3,,484,https://twitter.com/Mamadou41426631/status/1605663861608177682,https://twitter.com/Mamadou41426631,Waxal sii rapport bi,"Dec 21, 2022",2022-12-21T20:37:51.000Z
Seydou balde,@Seydoub35242872,,,1,1,91,https://twitter.com/Seydoub35242872/status/1605664115032133632,https://twitter.com/Seydoub35242872,Lousa ndy yone,"Dec 21, 2022",2022-12-21T20:38:51.000Z
Gaby SAGNA,@SagnaGaby,,,18,1,1.6K,https://twitter.com/SagnaGaby/status/1605662415487750145,https://twitter.com/SagnaGaby,Nioune dhei kou ligueyoul ak kouy wakh wakhi 3ieme mandat laniouye bagne à bon entendeur salut,"Dec 21, 2022",2022-12-21T20:32:06.000Z
ibn_Cheikhou,@ibn_cheikhou,,,1,,379,https://twitter.com/ibn_cheikhou/status/1605662454645751813,https://twitter.com/ibn_cheikhou,Yow mayñou diam,"Dec 21, 2022",2022-12-21T20:32:15.000Z
M.H.S,@agost8,"https://pbs.twimg.com/media/Fkh2Wi-WQAEqp8a?format=jpg&name=small, https://pbs.twimg.com/media/Fkh2Wi-WQAEqp8a?format=jpg&name=small",,29,1,2.2K,https://twitter.com/agost8/status/1605663399182041089,https://twitter.com/agost8,Ok degeunagn leu wayé,"Dec 21, 2022",2022-12-21T20:36:00.000Z
Mots-doux Dass,@Mamadou41426631,,,3,,484,https://twitter.com/Mamadou41426631/status/1605663861608177682,https://twitter.com/Mamadou41426631,Waxal sii rapport bi,"Dec 21, 2022",2022-12-21T20:37:51.000Z
Seydou balde,@Seydoub35242872,,,1,1,91,https://twitter.com/Seydoub35242872/status/1605664115032133632,https://twitter.com/Seydoub35242872,Lousa ndy yone,"Dec 21, 2022",2022-12-21T20:38:51.000Z
Tamzeii,@elhadji_tamsir,,,4,1,1.4K,https://twitter.com/elhadji_tamsir/status/1605662811631374336,https://twitter.com/elhadji_tamsir,Ioe dh 31 December bii laniouy xam baxam ioe arme mola fi jeulé wala,"Dec 21, 2022",2022-12-21T20:33:40.000Z
Salma,@Salma94000,,,16,,811,https://twitter.com/Salma94000/status/1605664597368881154,https://twitter.com/Salma94000,Waay libères pape alé et les autres. Hana do dioulite? Amo holou yeurmandé ?,"Dec 21, 2022",2022-12-21T20:40:46.000Z
@Isa_Lushiku,@Isa_Lushiku,,,6,,174,https://twitter.com/IsaLushiku/status/1605664956870848512,https://twitter.com/IsaLushiku,Condamnez aussi l'agression de mes compatriotes à l'est de la RDC par le terroriste Rwanda M23. Vous êtes muet et avez fermé vos yeux depuis le début... CONDAMNEZ,"Dec 21, 2022",2022-12-21T20:42:12.000Z
Ousmane Samb,@dioplemaire503,,,1,,127,https://twitter.com/dioplemaire503/status/1605665090623135753,https://twitter.com/dioplemaire503,Non au troisième mandat,"Dec 21, 2022",2022-12-21T20:42:44.000Z
Oumar,@SeydinaoumarCi8,,,1,,97,https://twitter.com/SeydinaoumarCi8/status/1605665298585190402,https://twitter.com/SeydinaoumarCi8,Cey Mbaye Séne weundélou,"Dec 21, 2022",2022-12-21T20:43:33.000Z
Gora Seck,@sec18308183,,,2,,63,https://twitter.com/sec18308183/status/1605667452989235200,https://twitter.com/sec18308183,Tant qu'il yaura des coups d'état constitutionnels il y aura des coups d'état militaire. Nous encourageons les militaires à toujours faire face aux coups d'état constitutionnels,"Dec 21, 2022",2022-12-21T20:52:07.000Z
Jiily,@JiilySock,,,3,,532,https://twitter.com/JiilySock/status/1605667458223788032,https://twitter.com/JiilySock,Je condamne fermement les 1000 milliards du contribuable sénégalais détournés par votre gouvernement pour soit disant fonds Covid-19. Le peuple sénégalais rejette avec vigueur toute tentative d’une troisième candidature à la présidentielle et reste focus sur 2024.,"Dec 21, 2022",2022-12-21T20:52:08.000Z
Le Phenix,@le_phenix1310,"https://pbs.twimg.com/media/Fkh7OpjWIAA5gDX?format=png&name=small, https://pbs.twimg.com/media/Fkh7OpjWIAA5gDX?format=png&name=small",,1,,78,https://twitter.com/le_phenix1310/status/1605668768582991873,https://twitter.com/le_phenix1310,,"Dec 21, 2022",2022-12-21T20:57:20.000Z
Le sentinelle de la République,@amath_ndour,,1.0,7,,426,https://twitter.com/amath_ndour/status/1605669524065378313,https://twitter.com/amath_ndour,Je m'associe à vous Excellence Président Macky SALL pour condamné ferment la tentative de prise de pouvoir par les armes.,"Dec 21, 2022",2022-12-21T21:00:21.000Z
Abidine Diop,@DiopAbidine,,,2,,198,https://twitter.com/DiopAbidine/status/1605669967164235791,https://twitter.com/DiopAbidine,"Coup d'état constitutionnel, coup d'état de la parole sacrée coup d'état de nos deniers publics sont fortement encouragés dans cette union d'escrocs","Dec 21, 2022",2022-12-21T21:02:06.000Z
L OEIL DU RIVERAIN,@l_riverain,"https://pbs.twimg.com/media/Fkh9JXOXgAIdH0J?format=jpg&name=small, https://pbs.twimg.com/media/Fkh9JXOXgAIdH0J?format=jpg&name=small",,2,1,331,https://twitter.com/l_riverain/status/1605670873763045382,https://twitter.com/l_riverain,L'homme des grands chantiers son excellence Macky Sall,"Dec 21, 2022",2022-12-21T21:05:42.000Z
Émile Shady Kayombo,@shady_emile,,,2,,201,https://twitter.com/shady_emile/status/1605671015685709824,https://twitter.com/shady_emile,"On vous connaît, vous finirez par travailler avec eux","Dec 21, 2022",2022-12-21T21:06:16.000Z
Maxim,@Maxim84137917,,,1,,47,https://twitter.com/Maxim84137917/status/1605671033045778432,https://twitter.com/Maxim84137917,Merci son Excellence non au coup d'État.,"Dec 21, 2022",2022-12-21T21:06:20.000Z
Sokhna Sadikh,@SokhnaSadikh,,,11,2,1.6K,https://twitter.com/SokhnaSadikh/status/1605671042273402901,https://twitter.com/SokhnaSadikh,Dès que j’ai eu écho de cette information je me suis senti trop mal. Pourquoi toujours la sous région ? Bref nous condamnons également cet acte ignoble.,"Dec 21, 2022",2022-12-21T21:06:23.000Z
Daouda YATTE,@DaoudaYATTE2,,1.0,11,19,7.1K,https://twitter.com/DaoudaYATTE2/status/1605671563143127041,https://twitter.com/DaoudaYATTE2,"Merci excellence pour votre esprit de solidarité . Le meilleur président du Sénégal  depuis l'indépendance . Votre candidature pour 2024 est une demande sociale . 
Macky mon candidat pour 2024","Dec 21, 2022",2022-12-21T21:08:27.000Z
Rahmane Dabo,@DaboRahmane,,5.0,242,15,12K,https://twitter.com/DaboRahmane/status/1605671829628149776,https://twitter.com/DaboRahmane,"Vient condamner cette chasse aux honnêtes citoyens dans ton propre pays, Dr Alfousseynou Gaye, Pape Alé Niang, Fadilou Keita, Cheikh Oumar Diagne, Outhmane Diagne....
La démocratie sénégalaise est à terre donc vous n'avez pas de leçon à donner aux autres pays africains.","Dec 21, 2022",2022-12-21T21:09:30.000Z
Mahamat Brahim,@Mahamat88024746,,,3,,199,https://twitter.com/Mahamat88024746/status/1605672016215957504,https://twitter.com/Mahamat88024746,Vous avez oublié de condamner Les Actes barbares commis par la junte Tchadienne suites aux exactions de 20 octobre 2022. cessé Un peu avec ces deux poids deux mesures s'il vous plaît.,"Dec 21, 2022",2022-12-21T21:10:15.000Z
"Mouhamed Sar DIOP, justice et droit de l'homme.",@mouhamed_sar,,,6,,350,https://twitter.com/mouhamed_sar/status/1605672017159540736,https://twitter.com/mouhamed_sar,"Nous condamnons aussi toute forme de roublardise pour rester au pouvoir,dans nos sociétés la parole donnée est au dessus de tout.","Dec 21, 2022",2022-12-21T21:10:15.000Z
Daouda YATTE,@DaoudaYATTE2,,1.0,16,22,14K,https://twitter.com/DaoudaYATTE2/status/1605672046477709312,https://twitter.com/DaoudaYATTE2,"Toutes mes félicitations mon président. Nous sommes fiers de vous président . Votre candidature en 2024 est une demande sociale . 
Focus sur 2024 
Pour votre intérêt dans la commune de yoff et à Dakar il faut nommer Abdoulaye Ndour","Dec 21, 2022",2022-12-21T21:10:22.000Z
AMADOU BA PR 2029,@HadjaDi2,,,3,,37,https://twitter.com/HadjaDi2/status/1605672413064224793,https://twitter.com/HadjaDi2,Merci Excellence pour votre posture adéquate et républicaine.,"Dec 21, 2022",2022-12-21T21:11:49.000Z
Mandiou Drame,@MandiouDrame2,,,4,,437,https://twitter.com/MandiouDrame2/status/1605672603275911168,https://twitter.com/MandiouDrame2,Bouleu yallah di juger Macky dineu tangg si iow déh bayil alalou mbollo bingay lékk douleu djik déh,"Dec 21, 2022",2022-12-21T21:12:35.000Z
L OEIL DU RIVERAIN,@l_riverain,"https://pbs.twimg.com/media/Fkh9JXOXgAIdH0J?format=jpg&name=small, https://pbs.twimg.com/media/Fkh9JXOXgAIdH0J?format=jpg&name=small",,2.0,1.0,331,https://twitter.com/l_riverain/status/1605670873763045382,https://twitter.com/l_riverain,L'homme des grands chantiers son excellence Macky Sall,"Dec 21, 2022",2022-12-21T21:05:42.000Z
Émile Shady Kayombo,@shady_emile,,,2.0,,201,https://twitter.com/shady_emile/status/1605671015685709824,https://twitter.com/shady_emile,"On vous connaît, vous finirez par travailler avec eux","Dec 21, 2022",2022-12-21T21:06:16.000Z
Maxim,@Maxim84137917,,,1.0,,47,https://twitter.com/Maxim84137917/status/1605671033045778432,https://twitter.com/Maxim84137917,Merci son Excellence non au coup d'État.,"Dec 21, 2022",2022-12-21T21:06:20.000Z
Sokhna Sadikh,@SokhnaSadikh,,,11.0,2.0,1.6K,https://twitter.com/SokhnaSadikh/status/1605671042273402901,https://twitter.com/SokhnaSadikh,Dès que j’ai eu écho de cette information je me suis senti trop mal. Pourquoi toujours la sous région ? Bref nous condamnons également cet acte ignoble.,"Dec 21, 2022",2022-12-21T21:06:23.000Z
Daouda YATTE,@DaoudaYATTE2,,1.0,11.0,19.0,7.1K,https://twitter.com/DaoudaYATTE2/status/1605671563143127041,https://twitter.com/DaoudaYATTE2,"Merci excellence pour votre esprit de solidarité . Le meilleur président du Sénégal  depuis l'indépendance . Votre candidature pour 2024 est une demande sociale . 
Macky mon candidat pour 2024","Dec 21, 2022",2022-12-21T21:08:27.000Z
Rahmane Dabo,@DaboRahmane,,5.0,242.0,15.0,12K,https://twitter.com/DaboRahmane/status/1605671829628149776,https://twitter.com/DaboRahmane,"Vient condamner cette chasse aux honnêtes citoyens dans ton propre pays, Dr Alfousseynou Gaye, Pape Alé Niang, Fadilou Keita, Cheikh Oumar Diagne, Outhmane Diagne....
La démocratie sénégalaise est à terre donc vous n'avez pas de leçon à donner aux autres pays africains.","Dec 21, 2022",2022-12-21T21:09:30.000Z
Mahamat Brahim,@Mahamat88024746,,,3.0,,199,https://twitter.com/Mahamat88024746/status/1605672016215957504,https://twitter.com/Mahamat88024746,Vous avez oublié de condamner Les Actes barbares commis par la junte Tchadienne suites aux exactions de 20 octobre 2022. cessé Un peu avec ces deux poids deux mesures s'il vous plaît.,"Dec 21, 2022",2022-12-21T21:10:15.000Z
"Mouhamed Sar DIOP, justice et droit de l'homme.",@mouhamed_sar,,,6.0,,350,https://twitter.com/mouhamed_sar/status/1605672017159540736,https://twitter.com/mouhamed_sar,"Nous condamnons aussi toute forme de roublardise pour rester au pouvoir,dans nos sociétés la parole donnée est au dessus de tout.","Dec 21, 2022",2022-12-21T21:10:15.000Z
Daouda YATTE,@DaoudaYATTE2,,1.0,16.0,22.0,14K,https://twitter.com/DaoudaYATTE2/status/1605672046477709312,https://twitter.com/DaoudaYATTE2,"Toutes mes félicitations mon président. Nous sommes fiers de vous président . Votre candidature en 2024 est une demande sociale . 
Focus sur 2024 
Pour votre intérêt dans la commune de yoff et à Dakar il faut nommer Abdoulaye Ndour","Dec 21, 2022",2022-12-21T21:10:22.000Z
AMADOU BA PR 2029,@HadjaDi2,,,3.0,,37,https://twitter.com/HadjaDi2/status/1605672413064224793,https://twitter.com/HadjaDi2,Merci Excellence pour votre posture adéquate et républicaine.,"Dec 21, 2022",2022-12-21T21:11:49.000Z
Mandiou Drame,@MandiouDrame2,,,4.0,,437,https://twitter.com/MandiouDrame2/status/1605672603275911168,https://twitter.com/MandiouDrame2,Bouleu yallah di juger Macky dineu tangg si iow déh bayil alalou mbollo bingay lékk douleu djik déh,"Dec 21, 2022",2022-12-21T21:12:35.000Z
AMADOU BA PR 2029,@HadjaDi2,,,3.0,,37,https://twitter.com/HadjaDi2/status/1605672413064224793,https://twitter.com/HadjaDi2,Merci Excellence pour votre posture adéquate et républicaine.,"Dec 21, 2022",2022-12-21T21:11:49.000Z
Mandiou Drame,@MandiouDrame2,,,4.0,,437,https://twitter.com/MandiouDrame2/status/1605672603275911168,https://twitter.com/MandiouDrame2,Bouleu yallah di juger Macky dineu tangg si iow déh bayil alalou mbollo bingay lékk douleu djik déh,"Dec 21, 2022",2022-12-21T21:12:35.000Z
PIN,@GmailIbhima,,,,,299,https://twitter.com/GmailIbhima/status/1605662647189352448,https://twitter.com/GmailIbhima,Le pouvoir se prend par les urnes et non par les armes. Vive la démocratie vive le président de L’UA.,"Dec 21, 2022",2022-12-21T20:33:01.000Z
Ibrahima Faye,@ibrahimafaye021,,,,,249,https://twitter.com/ibrahimafaye021/status/1605662739946299393,https://twitter.com/ibrahimafaye021,Macky sougnou bourses yi,"Dec 21, 2022",2022-12-21T20:33:23.000Z
Me Daouda Ibn Faoura Sow,@DFaoura,,,,,25,https://twitter.com/DFaoura/status/1605662992212799488,https://twitter.com/DFaoura,De tout cœur le Président Adama Barro.,"Dec 21, 2022",2022-12-21T20:34:23.000Z
丂卂爪乃卂,@sambapacha19,,,,,224,https://twitter.com/sambapacha19/status/1605663613783416832,https://twitter.com/sambapacha19,Ok,"Dec 21, 2022",2022-12-21T20:36:51.000Z
Princesse khary Ndiaye,@PrincesseKhary,,,,,196,https://twitter.com/PrincesseKhary/status/1605663919191646208,https://twitter.com/PrincesseKhary,Main dans la main avec le peuple Gambien,"Dec 21, 2022",2022-12-21T20:38:04.000Z
Mamoudou Mamou,@MamoudouMamou,,,,,90,https://twitter.com/MamoudouMamou/status/1605664508625575936,https://twitter.com/MamoudouMamou,Merci peresi,"Dec 21, 2022",2022-12-21T20:40:25.000Z
Le Rwanda tue en RDC,@MarcelMobutu,,,,,55,https://twitter.com/MarcelMobutu/status/1605664843264057351,https://twitter.com/MarcelMobutu,"Le chien aboie, la caravane passe paisible et assurément !","Dec 21, 2022",2022-12-21T20:41:45.000Z
Dialawalation,@dialawalation,,,,,195,https://twitter.com/dialawalation/status/1605665584514879488,https://twitter.com/dialawalation,Merci presi celui qui veut prendre le pouvoir n’a qu’à aller chercher les voix du peuple mais pas par la force ni par la désinformation,"Dec 21, 2022",2022-12-21T20:44:41.000Z
Mame,@Mame72109695,,,,,172,https://twitter.com/Mame72109695/status/1605665713934458886,https://twitter.com/Mame72109695,"Samba Alaar bi nga done 
So Xamone nimala bagné ioe","Dec 21, 2022",2022-12-21T20:45:12.000Z
Bamina Baldé,@baminabalde2,,,,,42,https://twitter.com/baminabalde2/status/1605665907069575176,https://twitter.com/baminabalde2,"Apprenez de la bonne posture de Vladimir Poutine face à l'intempérance occidentale,là vous serez exempts de toute sorte de déstabilisation,vous les chefs d'État africains.","Dec 21, 2022",2022-12-21T20:45:58.000Z
Aliass,@LiassidiA,,,,,33,https://twitter.com/LiassidiA/status/1605666148439261185,https://twitter.com/LiassidiA,Vous condamner toute prise de pouvoir par les armes mais legitimez vos coup d'état constitutionnel.,"Dec 21, 2022",2022-12-21T20:46:56.000Z
waly bodian,@walylywa,,,,,30,https://twitter.com/walylywa/status/1605666579085156365,https://twitter.com/walylywa,Guignol tu es pire que tout être maléfique tu es l'incarnation de la lâcheté et de la méchanceté et de la trahison va au diable,"Dec 21, 2022",2022-12-21T20:48:38.000Z
Aliou Faye,@AliouFa21886328,,,,,113,https://twitter.com/AliouFa21886328/status/1605666581949796352,https://twitter.com/AliouFa21886328,Grand macki mangi ziarr,"Dec 21, 2022",2022-12-21T20:48:39.000Z
PSG,@gvenore,,,,,95,https://twitter.com/gvenore/status/1605667493288329218,https://twitter.com/gvenore,nul ne peut faire plus de 2 mandats consécutifs,"Dec 21, 2022",2022-12-21T20:52:16.000Z
M. DJALO,@NelNel94786635,,,,,33,https://twitter.com/NelNel94786635/status/1605668653420216320,https://twitter.com/NelNel94786635,,"Dec 21, 2022",2022-12-21T20:56:53.000Z
L OEIL DU RIVERAIN,@l_riverain,,,,,80,https://twitter.com/l_riverain/status/1605670699619667968,https://twitter.com/l_riverain,Mes félicitations et encouragements monsieur le Président Macky Sall pour votre  bonne démarche a l'endroit du pays soeur la Gambie,"Dec 21, 2022",2022-12-21T21:05:01.000Z
L OEIL DU RIVERAIN,@l_riverain,,,,,57,https://twitter.com/l_riverain/status/1605670739545317379,https://twitter.com/l_riverain,Bonne démarche monsieur le Président,"Dec 21, 2022",2022-12-21T21:05:10.000Z
Pap Sané,@SaneDiame,,,22.0,,676,https://twitter.com/SaneDiame/status/1605673454325272576,https://twitter.com/SaneDiame,"Merci de condamner président mais n'oubliez pas que nul ne peut faire plus de deux mandats consécutifs au Sénégal.
Bu ko sakh jëm.","Dec 21, 2022",2022-12-21T21:15:58.000Z
modou mbengue,@modoumb62991937,,,6.0,,221,https://twitter.com/modoumb62991937/status/1605674631393861667,https://twitter.com/modoumb62991937,Bala nga lakh di diaye lakhal diokh sa wa keur niou lekk ba soukh Yaw yangui tall sa keur lidianti woko na paré di wakh déstabilisation du gouvernement de Gambie ton gouvernement est plus déstabilisé que déstabilisé,"Dec 21, 2022",2022-12-21T21:20:38.000Z
Sambis,@SekjcE,,,3.0,,371,https://twitter.com/SekjcE/status/1605675467679203328,https://twitter.com/SekjcE,"Constituon du Senegal:
""Null ne peut exercer plus de 2 mandats consecutifs.""

Cher présidents africains,
respecter vos paroles et les coups d'Etat diminueront naturellement.","Dec 21, 2022",2022-12-21T21:23:58.000Z
Saliou Séne,@saliousene90,"https://pbs.twimg.com/media/FkiCYmVWAAAc2cP?format=jpg&name=small, https://pbs.twimg.com/media/FkiCYmVWAAAc2cP?format=jpg&name=small",,3.0,,15,https://twitter.com/saliousene90/status/1605676631644729344,https://twitter.com/saliousene90,,"Dec 21, 2022",2022-12-21T21:28:35.000Z
Alioune Coumba Ndiaye,@alioune_coumba,,,3.0,,304,https://twitter.com/alioune_coumba/status/1605677311264595968,https://twitter.com/alioune_coumba,Nul ne peut exercer plus de 2 mandats ! Essayez et le reste s'en suivra ......,"Dec 21, 2022",2022-12-21T21:31:17.000Z
SOW Abdourahmane,@basse_catalan,,1.0,23.0,,250,https://twitter.com/basse_catalan/status/1605677467967950848,https://twitter.com/basse_catalan,Macky Sall fait attention à toi. T'as pas de leçon de démocratie à donner à qui que ce soit. Dans ton pays on entend toujours les jours de détournements & scandales. Tu protèges tes proches qui veulent nos biens & emprisonne ceux qui dénoncent les scandales. Démissionne fraude bi,"Dec 21, 2022",2022-12-21T21:31:55.000Z
Fari,@Rifa2f,,,23.0,1.0,1.5K,https://twitter.com/Rifa2f/status/1605681028609081344,https://twitter.com/Rifa2f,Il suffit d'ouvrir les yeux pour se rendre compte que tout coup d'état constitutionnel se terminera pas un coup d'état militaire. Épargne nous ce scénario please.,"Dec 21, 2022",2022-12-21T21:46:03.000Z
Saliou Séne,@saliousene90,,,,,14,https://twitter.com/saliousene90/status/1605671161257263104,https://twitter.com/saliousene90,Nous resterons aussi solidaire à l’encontre du président Adama Barrow.,"Dec 21, 2022",2022-12-21T21:06:51.000Z
𝓡𝓪𝓬𝓱𝓲𝓭,@Soule81913410,,,,,11,https://twitter.com/Soule81913410/status/1605671239988629504,https://twitter.com/Soule81913410,"Tant que nos dirigeants ne vont pas écouter le cri de leur peuple, il y aura toujours coups d'État c'est la réalité des faits","Dec 21, 2022",2022-12-21T21:07:10.000Z
Sokhna Sadikh,@SokhnaSadikh,"https://pbs.twimg.com/media/Fkh9mLCWYBIji1I?format=jpg&name=small, https://pbs.twimg.com/media/Fkh9mLCWYBIji1I?format=jpg&name=small",,,,21,https://twitter.com/SokhnaSadikh/status/1605671368871272457,https://twitter.com/SokhnaSadikh,,"Dec 21, 2022",2022-12-21T21:07:40.000Z
Sokhna Sadikh,@SokhnaSadikh,https://pbs.twimg.com/media/Fkh9pIbWYA4mNKw?format=jpg&name=small,,,,32,https://twitter.com/SokhnaSadikh/status/1605671417587957761,https://twitter.com/SokhnaSadikh,,"Dec 21, 2022",2022-12-21T21:07:52.000Z
Sokhna Sadikh,@SokhnaSadikh,https://pbs.twimg.com/media/Fkh9q5LWAAIYw4W?format=jpg&name=small,,,,21,https://twitter.com/SokhnaSadikh/status/1605671448353406976,https://twitter.com/SokhnaSadikh,,"Dec 21, 2022",2022-12-21T21:07:59.000Z
Sokhna Sadikh,@SokhnaSadikh,"https://pbs.twimg.com/media/Fkh9q5LWAAIYw4W?format=jpg&name=small, https://pbs.twimg.com/media/Fkh9q5LWAAIYw4W?format=jpg&name=small",,,,21,https://twitter.com/SokhnaSadikh/status/1605671448353406976,https://twitter.com/SokhnaSadikh,,"Dec 21, 2022",2022-12-21T21:07:59.000Z
Sokhna Sadikh,@SokhnaSadikh,"https://pbs.twimg.com/media/Fkh9tZaWYBo9wpn?format=jpg&name=small, https://pbs.twimg.com/media/Fkh9tZaWYBo9wpn?format=jpg&name=small",,,,20,https://twitter.com/SokhnaSadikh/status/1605671491080572928,https://twitter.com/SokhnaSadikh,,"Dec 21, 2022",2022-12-21T21:08:10.000Z
Sokhna Sadikh,@SokhnaSadikh,"https://pbs.twimg.com/media/Fkh9wXdWYBkSfxk?format=jpg&name=small, https://pbs.twimg.com/media/Fkh9wXdWYBkSfxk?format=jpg&name=small",,,,14,https://twitter.com/SokhnaSadikh/status/1605671542146203648,https://twitter.com/SokhnaSadikh,,"Dec 21, 2022",2022-12-21T21:08:22.000Z
Sokhna Sadikh,@SokhnaSadikh,"https://pbs.twimg.com/media/Fkh9ycrWIAEvGcT?format=jpg&name=small, https://pbs.twimg.com/media/Fkh9ycrWIAEvGcT?format=jpg&name=small",,,,24,https://twitter.com/SokhnaSadikh/status/1605671577382707205,https://twitter.com/SokhnaSadikh,,"Dec 21, 2022",2022-12-21T21:08:30.000Z
MÙSTAFA MHD DJUUF,@Moustap81561400,,,2.0,,117,https://twitter.com/Moustap81561400/status/1605672936437866508,https://twitter.com/Moustap81561400,Je déteste votre politique étrangère...En tant qu'étudiant en développement local.,"Dec 21, 2022",2022-12-21T21:13:54.000Z
Daouda Coulibaly,@Kiing_Dave_,,,2.0,,228,https://twitter.com/Kiing_Dave_/status/1605674627706937344,https://twitter.com/Kiing_Dave_,mollah ngui diokher audio yi sur son live instant yi mr le persident diapeul gaww,"Dec 21, 2022",2022-12-21T21:20:37.000Z
Zou Yacouba,@ZouYacouba2,,,,1.0,82,https://twitter.com/ZouYacouba2/status/1605675030456721422,https://twitter.com/ZouYacouba2,C'est pas vous qui êtes allé chasser yaya?,"Dec 21, 2022",2022-12-21T21:22:13.000Z
AMADOU BA PR 2029,@HadjaDi2,"https://pbs.twimg.com/media/FkiCuyXWYAAvCom?format=jpg&name=small, https://pbs.twimg.com/media/FkiCuyXWYAAvCom?format=jpg&name=small",,1.0,,23,https://twitter.com/HadjaDi2/status/1605677009866219545,https://twitter.com/HadjaDi2,,"Dec 21, 2022",2022-12-21T21:30:05.000Z
AMADOU BA PR 2029,@HadjaDi2,"https://pbs.twimg.com/media/FkiDVEJWYA8kqnF?format=jpg&name=small, https://pbs.twimg.com/media/FkiDVEJWYA8kqnF?format=jpg&name=small",,1.0,,19,https://twitter.com/HadjaDi2/status/1605677670775132160,https://twitter.com/HadjaDi2,,"Dec 21, 2022",2022-12-21T21:32:43.000Z
AMADOU BA PR 2029,@HadjaDi2,https://pbs.twimg.com/media/FkiDsNAWYCQAqBS?format=jpg&name=small,,1.0,,20,https://twitter.com/HadjaDi2/status/1605678067166216192,https://twitter.com/HadjaDi2,,"Dec 21, 2022",2022-12-21T21:34:17.000Z
AMADOU BA PR 2029,@HadjaDi2,"https://pbs.twimg.com/media/FkiDVEJWYA8kqnF?format=jpg&name=small, https://pbs.twimg.com/media/FkiDVEJWYA8kqnF?format=jpg&name=small",,1.0,,19,https://twitter.com/HadjaDi2/status/1605677670775132160,https://twitter.com/HadjaDi2,,"Dec 21, 2022",2022-12-21T21:32:43.000Z
AMADOU BA PR 2029,@HadjaDi2,"https://pbs.twimg.com/media/FkiDsNAWYCQAqBS?format=jpg&name=small, https://pbs.twimg.com/media/FkiDsNAWYCQAqBS?format=jpg&name=small",,1.0,,20,https://twitter.com/HadjaDi2/status/1605678067166216192,https://twitter.com/HadjaDi2,,"Dec 21, 2022",2022-12-21T21:34:17.000Z
Sultan,@tall_sire,,,1.0,,408,https://twitter.com/tall_sire/status/1605679864937254912,https://twitter.com/tall_sire,Kone Gambie pays leu ?,"Dec 21, 2022",2022-12-21T21:41:26.000Z
MC THIAM,@MCTHIAMO,,1.0,,,16,https://twitter.com/MCTHIAMO/status/1605680590774099968,https://twitter.com/MCTHIAMO,toute prise de pouvoir par les armes est une abomination car aucun humain n'est digne de commander ses semblables alors qu'ils n'ont donné leur consentement. Le pouvoir ne doit s'acquérir que par les urnes,"Dec 21, 2022",2022-12-21T21:44:19.000Z
Galy DOUBANE,@GDoubane,"https://pbs.twimg.com/media/FkiGiIAXoCI-vKo?format=jpg&name=small, https://pbs.twimg.com/media/FkiGiIAXoCI-vKo?format=jpg&name=small",1.0,6.0,,1.4K,https://twitter.com/GDoubane/status/1605681190593339400,https://twitter.com/GDoubane,"Félicitations Monsieur le Président, nous sommes très fière de vous voir prononcer sur l'application de la charte de l'Union Africaine sur la prise du pouvoir. Nous vous demandons, pourquoi l'UA était silencieuse sur les autres pays qui ont marché sur ses lois?@Tchad,@BF,@mali...","Dec 21, 2022",2022-12-21T21:46:42.000Z
